{
  "id": "budget-table",
  "name": "Budget Table",
  "author": "jubnl",
  "description": "Bring back the pre-v3.1 categorized budget table",
  "repo": "jubnl/Trek_Plugin-Budget_Table",
  "type": "trip-page",
  "versions": [
    {
      "version": "1.0.0",
      "gitTag": "v1.0.0",
      "commitSha": "7169ab9732b5c3c1dd8eec49b46abb208f4496de",
      "downloadUrl": "https://github.com/jubnl/Trek_Plugin-Budget_Table/releases/download/v1.0.0/plugin.zip",
      "sha256": "dd20ebddd33c344594fadcb42f350f41d9e0dac495637c63d49f0da86bfeac29",
      "minTrekVersion": "3.2.1",
      "size": 24141,
      "apiVersion": 1,
      "nativeModules": false,
      "publishedAt": "2026-07-06T00:05:35.905Z"
    }
  ]
}
